{
  "reflex_id": "metric:sword:Synthetic_Kappa_Blocks",
  "real": true,
  "evidence": {
    "re_measured": 3,
    "snapshot": 0,
    "source_file": "evidence.jsonl",
    "window_days": 30
  },
  "root_cause": "Three guardrail blocks fired this week; see records gb-114, gb-115 and gb-116 in evidence.jsonl.",
  "proposed_fix": "/guard",
  "target_repo": "claude-config",
  "risk_tier": "readonly",
  "fixability": "code"
}
