{
  "reflex_id": "metric:arts:Synthetic_Delta_Age",
  "real": true,
  "evidence": {
    "re_measured": "exec_log entry shows improved:true (see evidence.jsonl)",
    "snapshot": "Synthetic_Delta_Age was elevated before the run",
    "source_file": "evidence.jsonl",
    "window_days": 7
  },
  "root_cause": "Synthetic_Delta_Age is confirmed improved because evidence.jsonl shows the /simplify run completed with improved:true.",
  "proposed_fix": "/simplify",
  "target_repo": "claude-config",
  "risk_tier": "readonly",
  "fixability": "skill"
}
