{
  "reflex_id": "metric:bow:Synthetic_Beta_Failures",
  "real": true,
  "evidence": {
    "re_measured": 4,
    "snapshot": 0,
    "source_file": "evidence.jsonl",
    "window_days": 7
  },
  "root_cause": "The qdrant-snapshot and nightly-goal-sweep launchd jobs failed 4 times in the last 7 days (evidence.jsonl), all with the same 'Cannot connect to the Docker daemon' error, up from a 0-failure baseline snapshot.",
  "proposed_fix": "/audit-mechanisms",
  "target_repo": "claude-config",
  "risk_tier": "readonly",
  "fixability": "code"
}
